Title,Industries,Job Skills
Driver Cum Delivery Man,"['Retail Fashion FMCG', 'Retail Fashion FMCG', 'Retail Fashion FMCG']",Driving and Working with a team and Computer Skills
Driver For Minn Tun Trading Co Ltd,['Travel Tourism Transportation'],Driver yr
Driver Posts,['Automotive Aviation'],Driver
Driver Yangon Yankin Township,['Automotive Aviation'],Driving Vehicles
Driver travel tourism,['Travel Tourism Transportation'],operation project
E Commerce Manager,['Construction Engineering'],Sales Marketing Management Pr
EXPORT IMPORT STAFF Documentation,['Shipping Logistics'],Microsoft s
Early Years Class Teacher,"['Education Training', 'Education Training', 'Education Training', 'Education Training', 'Education Training', 'Education Training', 'Education Training', 'Education Training']",Teaching Pre Young Adults and Teaching English Language and Teaching Mathematics and Teaching and Supervision and Teaching with activities and Teaching english to children and Good at motivating and teaching and Professional Driving Skills
Economic Lecturer Part Time,"['Education Training', 'Education Training', 'Education Training', 'Education Training']",Teaching sharing Knowledge and Teaching and Presentation and Teaching and Training and Teaching Coaching
Editor,"['Advertising Media Communications', 'Advertising Media Communications']",TV and Entertainment Production and Advertising Promotions
Education Consultant,"['Education Training', 'Education Training', 'Education Training']",Education Leadership and Education Counselling and Educational Field
Education Counsellor,"['Education Training', 'Education Training']",Education Counselling and Educational Field
Educational Counsellor,['Education Training'],Education Counselling
Electrical Engineer,"['Construction Engineering', 'Construction Engineering', 'Construction Engineering', 'Construction Engineering', 'Construction Engineering']",Proactive and teamwork skills and Proactive and teamwork skills and IT literacy and Proactive and teamwork skills and IT literacy
Electrical Engineer Solar Field,['Construction Engineering'],Electrical Engineering
Electrical Maintenance Myo Thar,['Manufacturing Warehousing'],Maintenance M E
Electrical engineer Yangon,['Manufacturing Warehousing'],Retail Category Management
Energy Manager,['IT Telecom'],Telecom Operation
Event Activations Manager,"['Advertising Media Communications', 'Advertising Media Communications', 'Advertising Media Communications', 'Advertising Media Communications', 'Advertising Media Communications', 'Advertising Media Communications', 'Advertising Media Communications', 'Advertising Media Communications']",Creative idea and Creativity Event planner and Time Management and Event Planning and Management and Creative idea and Time Management and Creativity Event planner and Event Planning and Management
Event Planning Manager Strategic Account Manager,"['Advertising Media Communications', 'Advertising Media Communications', 'Advertising Media Communications', 'Advertising Media Communications', 'Advertising Media Communications', 'Advertising Media Communications', 'Advertising Media Communications', 'Advertising Media Communications', 'Advertising Media Communications', 'Advertising Media Communications']",Working under pressure and Agency Vendor Management and Client relationship skill and Event Planning and Management and Overseeing and Manage Architect and Working under pressure and Agency Vendor Management and Client relationship skill and Event Planning and Management and Overseeing and Manage Architect
Executive Assistant Win Myint Mo Industries Company,['Energy Utilities'],Financial Analysis Repoting
Executive Assistant to CFO Win Myint Mo Industries Company,['Construction Engineering'],Ability to manage
Executive Sales Inside Post,"['Advertising Media Communications', 'Advertising Media Communications', 'Advertising Media Communications', 'Advertising Media Communications', 'Advertising Media Communications']",distribution marketing and Computer Skills Advanced and Email internet and Computer excel word internet em and Advance
Executive Secretary,"['Hospitality Hotel', 'Hospitality Hotel']",PR and Communication and Good Computer literacy
Executive Secretary Chinese Speaking Act like translator as well,"['Retail Fashion FMCG', 'Retail Fashion FMCG']",Computer Microsoft series and Teamwork communication skills
F B Captain,['Hospitality Hotel'],Ability to work under pressure
FME Field Maintenance Engineer,"['IT Telecom', 'IT Telecom', 'IT Telecom']",Teamwork communication skills and operation project and Ability to work flexibly
Facebook Live Sales Girl,['Manufacturing Warehousing'],Social media marketing
Facebook Page Admin,"['Retail Fashion FMCG', 'Retail Fashion FMCG']",Social Media and Facebook digital tools
Factory General Manager Male Post,['Agriculture'],Teamwork communication skills
Factory Manager Yangon,"['Manufacturing Warehousing', 'Manufacturing Warehousing', 'Manufacturing Warehousing', 'Manufacturing Warehousing', 'Manufacturing Warehousing', 'Manufacturing Warehousing', 'Manufacturing Warehousing', 'Manufacturing Warehousing']",Leadership skill and Production process management and Factory Maintenance and Utility and Factory Management Skill and Leadership skill and Production Management and Factory Maintenance and Utility and Factory Management Skill
Factory Supervisor Yangon,"['Manufacturing Warehousing', 'Manufacturing Warehousing', 'Manufacturing Warehousing']",Production process management and Factory maintenance and Factory Management Skill
Field Engineer,['IT Telecom'],Telecom Operation
Field Technician,['IT Telecom'],Telecom Operation
Finance Accountant and admin staff,"['NGO NPO Charity', 'NGO NPO Charity', 'NGO NPO Charity', 'NGO NPO Charity', 'NGO NPO Charity', 'NGO NPO Charity', 'NGO NPO Charity', 'NGO NPO Charity']",Finance Accounting Field and Problem Solving Skill and Account payable Receivable and Admin Accountant and Fixed Asset Control and Microsoft Office Word Excel and Proactive and positive thinking and Payroll and budgeting
Finance Accounting Executive,"['Entertainment Events', 'Entertainment Events', 'Entertainment Events', 'Entertainment Events']",Finance Accounting Field and Vendor management and Accounting Finance and Client Relation Satisfaction
Finance Assistant,"['Retail Fashion FMCG', 'Retail Fashion FMCG', 'Retail Fashion FMCG', 'Medical Healthcare']",Accounting and Finance and Internal Audit and Proactive and teamwork skills
Finance Associate Female Posts YGN MDY,['Shipping Logistics'],Teamwork communication skills
Finance Executive,"['Retail Fashion FMCG', 'Retail Fashion FMCG', 'Retail Fashion FMCG']",Banking and Finance Skill and Accounting and Finance and Excel pre financial statements
Finance Lecturer Part Time,"['Education Training', 'Education Training', 'Education Training', 'Education Training']",Finance Accounting Field and Teaching sharing Knowledge and Teaching and Presentation and Teaching Coaching
Finance Manager,"['Education Training', 'Education Training', 'Advertising Media Communications', 'Advertising Media Communications', 'Advertising Media Communications', 'Advertising Media Communications', 'Advertising Media Communications', 'Advertising Media Communications', 'Advertising Media Communications', 'Advertising Media Communications']",Finance Accounting Field and Finance Manager and Financial Analysic Budgeting and Finance Accounting Field and Financial Reporting and Financial Analysis and Financial Analysic Budgeting and Finance Accounting Field and Financial Reporting and Financial Analysis
Finance Manager Construction Sector,"['Advisory and Financial Services', 'Advisory and Financial Services', 'Advisory and Financial Services']",Finance Accounting Field and Construction and ACCA part
Finance Officer Assistant Posts,['Food Beverages'],Banking and Finance Skill
Finance and Operations Manager,"['NGO NPO Charity', 'NGO NPO Charity', 'NGO NPO Charity', 'NGO NPO Charity']",Accounting and Project Operation Management and Finance management and Compliance Audit
Firemen,['Energy Utilities'],Proactive and teamwork skills
Fitter Fresh Air Systems Mandalay and Nay Pyi Taw,['Construction Engineering'],Beginner
Fleet Manager Ywarthargyi,"['Shipping Logistics', 'Shipping Logistics', 'Shipping Logistics']",Logistics and fleet Management and Time Management and Well known in Transport sector
Fleet Support Transport Operations,['Shipping Logistics'],Fleet Management
Foreman Yangon,"['Manufacturing Warehousing', 'Manufacturing Warehousing']",Factory and foreman production
Forklift Driver,"['Shipping Logistics', 'Shipping Logistics']",Driving Skill and Can drive well forklift
Freelance Video Editor,['Recruitment'],Video photo editing
Freight forwading Operation executive,['Shipping Logistics'],Freight forwarding operation
Freight forwarding sales executive,"['Shipping Logistics', 'Shipping Logistics']",Logistics Freight Forwarding and Freight Forwarding Marketing
Front Office Junior Receptionist,['Hospitality Hotel'],Microsoft Office
Front Office Supervisor,['Hospitality Hotel'],Front Office Supervisor
Frontend Mobile and Web Developer React Native React JS,['Travel Tourism Transportation'],Basic Developer Skills
Fuel Coordinator,['IT Telecom'],Energy
Full Stack Web Developer Tachileik,"['Retail Fashion FMCG', 'Retail Fashion FMCG', 'Retail Fashion FMCG', 'Retail Fashion FMCG']",communication with all levels and Web Development WordPress and creative web design and Fundamental of Web Technology
GED Instructor,"['Education Training', 'Education Training', 'Education Training', 'Education Training', 'Education Training', 'Education Training']",Teamwork and collaboration and Teaching English and Social Sci and Teaching and Training and Teaching Mathematics Physics and Social Studies teaching and Communication Patience Hardwork
GSA Reception,['Hospitality Hotel'],Proactive and teamwork skills
GSA Steward,['Hospitality Hotel'],Teamwork communication skills
General Manager,"['Medical Healthcare', 'Medical Healthcare', 'Medical Healthcare', 'Medical Healthcare', 'Medical Healthcare', 'Medical Healthcare', 'Medical Healthcare', 'NGO NPO Charity', 'Manufacturing Warehousing', 'Manufacturing Warehousing', 'Manufacturing Warehousing', 'Manufacturing Warehousing']",General management and Operation Management and Sales Management and customer services and Team Leadership and Beauty Spa and Advertising promotion Event and Proactive and teamwork skills and Production Management and Manufacturing Field and Manufacturing Field and Manufacturing Operations
General Manager Real Estate URGENT,['Property Real Estate'],Real estate
Golf Pro Shop,['Hospitality Hotel'],Sales Distribution
Government Liaison Coordinator,"['Education Training', 'Education Training', 'Education Training']",Office and Administration and Teamwork communication skills and Admin Data entry
Grant and Partnership Officer,"['Retail Fashion FMCG', 'Retail Fashion FMCG', 'Retail Fashion FMCG', 'Retail Fashion FMCG']",Contract Management and Financial and Procurement and Negotiation and Office administration skills
Graphic Design Officer,"['Hospitality Hotel', 'Hospitality Hotel', 'Hospitality Hotel']",Graphic designer and Adobe Photoshop CC and Adobe Illustrator CC
Graphic Designer,"['Construction Engineering', 'Construction Engineering', 'Construction Engineering', 'Construction Engineering', 'Construction Engineering', 'Medical Healthcare', 'Advertising Media Communications', 'Advertising Media Communications', 'Property Real Estate', 'Property Real Estate', 'Property Real Estate', 'Construction Engineering', 'Construction Engineering', 'Construction Engineering', 'Education Training', 'Education Training', 'Advertising Media Communications', 'Advertising Media Communications', 'Advertising Media Communications', 'Advertising Media Communications', 'Advertising Media Communications', 'Advertising Media Communications', 'Advertising Media Communications', 'Advertising Media Communications', 'Hospitality Hotel', 'Medical Healthcare', 'Property Real Estate', 'Hospitality Hotel', 'IT Telecom', 'IT Telecom', 'IT Telecom']",Proactive and teamwork skills and Microsoft s and Government Process and Learing and Designing implementation and Communication Teamwork and Editor Graphic Designer and Graphic Design Creation and Problem Solving Skill and Graphic designer and creativity and innovation and Creativity Typography and Graphic design and Photo Video Editing and Graphic designer and Graphic design and Time management and Good communication skill and Good team works and Graphic Designs Creation and Social Media Ads Design and Graphic designer and Graphic Design for Social Media and Adobe Premiere Motion graphic and DTP photoshop Graphic Design and Designing implementation and Microsoft s and Advertising and Promotions and Communication Skills and Teamwork and Creative Skills
Graphic Designer Mandalay Male Post,['Agriculture'],Graphic designer
Graphic Designer Tachileik,"['Retail Fashion FMCG', 'Retail Fashion FMCG', 'Retail Fashion FMCG', 'Retail Fashion FMCG']",creativity and innovation and Creative Designs Layout Design and Very good communication skills and Social Media Trends
Graphic Designer Urgent,"['Advertising Media Communications', 'Advertising Media Communications', 'Advertising Media Communications']",DTP photoshop Graphic Design and Graphic Designs and Graphic Designs Creation
Graphic Designer Yangon,"['Manufacturing Warehousing', 'Manufacturing Warehousing', 'Manufacturing Warehousing', 'Manufacturing Warehousing']",Graphic design illustration and Graphic Designs Creation and Graphics Video Editing and Photoshop and graphic
Graphit Designer,"['Advisory and Financial Services', 'Advisory and Financial Services']",Proactive and teamwork skills and Designing implementation
Grounds Keeper,"['Education Training', 'Education Training', 'Education Training']",Housekeeping and Housekeeping and Gardener and garden
HR,['BPO Business Process Outsourcing'],Bookkeeping of accounts
HR Admin Executive,"['Banking Micro finance Insurance', 'Banking Micro finance Insurance', 'Banking Micro finance Insurance', 'Retail Fashion FMCG']",Negotiation Skills and Payroll and recruitment and Problem Soving Skill and HR Admin Field
HR Admin Manager,"['Enforcement Security', 'Enforcement Security', 'Enforcement Security']",IT literacy and Microsoft s and Government Process
HR Admin Staff,"['Recruitment', 'Recruitment']",Adminstration of human Resource and Human Resources Skills
HR Assistant,"['Education Training', 'Education Training', 'Education Training']",HR Management Operation Admin and English Communication Skills and Recruitment Customer Service
HR Assistant Manager,"['Retail Fashion FMCG', 'Retail Fashion FMCG', 'Retail Fashion FMCG', 'Retail Fashion FMCG', 'Retail Fashion FMCG']",High level of problem solving and Organization skill and HRM and HRD and Great time management skill and Negotitation
HR Associate,"['IT Telecom', 'IT Telecom', 'IT Telecom']",Communication Skills and Communicative English and HRM knowledge
HR Executive,['Hospitality Hotel'],Administration HR
HR Executive Training Development,"['Medical Healthcare', 'Medical Healthcare', 'Medical Healthcare', 'Medical Healthcare', 'Medical Healthcare']",HR Skill Knowledge and Ability to manage and Ability to work flexibly and Communication team work and HR management collaboration
HR Manager,"['Medical Healthcare', 'Medical Healthcare', 'Advertising Media Communications', 'Advertising Media Communications', 'Advertising Media Communications', 'Advertising Media Communications', 'Advertising Media Communications', 'Advertising Media Communications', 'Advertising Media Communications', 'Advertising Media Communications', 'Advertising Media Communications', 'Advertising Media Communications', 'Manufacturing Warehousing', 'Manufacturing Warehousing', 'Manufacturing Warehousing']",HRM HRD and English Intermediate and HR Management Operation Admin and Interpersonal Communication and flexible to work with all and Leadership influencing and good personality and Energetic and HR Management Operation Admin and Interpersonal Communication and flexible to work with all and Leadership influencing and good personality and Energetic and Manufacturing Field and Manufacturing Field and Manufacturing Field
HR Officer,"['Medical Healthcare', 'Medical Healthcare', 'Medical Healthcare', 'Medical Healthcare', 'Construction Engineering', 'Construction Engineering', 'Construction Engineering', 'Construction Engineering', 'Construction Engineering', 'Construction Engineering', 'Construction Engineering', 'Construction Engineering', 'Construction Engineering']",Administration HR and HR Skill Knowledge and HR management collaboration and Negotiation Mediation and Problem Solving Skill and Interpersonal skill and Microsoft Word Excel Power Po and Office administrative Jobs and Excellent Communication and Confidentiality Accuracy and Business English Communication and HUMAN RESOURCES MANAGEMENT and Confident and positive attitude
HR Officer For Naungdon Post,['Agriculture'],Administration HR
HR Staff,['Construction Engineering'],Administration HR
HR Supervisor,"['Education Training', 'Education Training', 'Education Training', 'Education Training', 'Education Training']",Microsoft Office and Communication Skills and Microsoft and Negotiation and Viber for Business
HR admin supervisor post Male or Female,['Medical Healthcare'],Administration HR
HRD Training and Development,['Food Beverages'],HRM HRD
HSE Department Assistant,"['Energy Utilities', 'Energy Utilities', 'Energy Utilities', 'Energy Utilities', 'Energy Utilities', 'Energy Utilities', 'Energy Utilities', 'Energy Utilities', 'Energy Utilities', 'Energy Utilities']",Computer Microsoft series and Engineering Knowledge and Able to travel and Languages Myan Eng and Chinese and Communication Patience Hardwork and Computer Microsoft series and Engineering Knowledge and Able to travel and Languages Myan Eng and Chinese and Communication Patience Hardwork
HSE specialist HSE,['Energy Utilities'],Proactive and teamwork skills
Head Chef,['Retail Fashion FMCG'],kitchen management cake bread
Head Of Strategic Planning And Project Management,"['Banking Micro finance Insurance', 'Banking Micro finance Insurance', 'Banking Micro finance Insurance', 'Banking Micro finance Insurance']",Problem Solving and Multi Tasking Process and distribution marketing and Ability to manage
Head of Finance,['Hospitality Hotel'],Credit Card Machines
Head of Internal Audit Win Myint Mo Industries Co Ltd,"['Mining Metal Chemicals', 'Mining Metal Chemicals', 'Mining Metal Chemicals']",Banking Finance and Planning communicating monitor and Team work leadership analytic
Head of Marketing,"['Manufacturing Warehousing', 'IT Telecom']",Sales Marketing Manager and Marketing and Communication
Head of Sales,"['IT Telecom', 'IT Telecom', 'IT Telecom', 'IT Telecom']",Operation Management and Sales Management and Leadership skill and Businesses Development
Housekeeping Laundry,['Hospitality Hotel'],Housekeeping
Hr Manager,['Manufacturing Warehousing'],Administration HR
Human Resource Administration Executive,"['Advertising Media Communications', 'Advertising Media Communications', 'Advertising Media Communications', 'Advertising Media Communications', 'Advertising Media Communications', 'Advertising Media Communications', 'Advertising Media Communications']",Strong Communication Skill and High level of problem solving and Negotiation Skills and Office and Administration and Time management and Media Production and Human Resource Manangement
Human Resource Executive,"['Entertainment Events', 'Entertainment Events', 'Entertainment Events', 'Entertainment Events']",Administration and Planing and organizing and Proactive and teamwork skills and Administration HR
Human Resource Manager Chinese English Burmese,"['IT Telecom', 'IT Telecom', 'IT Telecom', 'IT Telecom', 'IT Telecom']",communication with all levels and HR Management Operation Admin and Language Fluent in English and Proactive and teamwork skills and IT literacy
Human Resources Officer,['Travel Tourism Transportation'],HR Skill Knowledge
I C technician,['Energy Utilities'],Proactive and teamwork skills
IT Application Support Ywarthargyi,"['Shipping Logistics', 'Shipping Logistics', 'Shipping Logistics', 'Shipping Logistics', 'Shipping Logistics', 'Shipping Logistics']",Communicative English and Technical skill and Developing Website and Communicative English and Technical skill and Developing Website
IT Assistant,['Construction Engineering'],IT literacy
IT Associate,"['Education Training', 'Education Training', 'Education Training']",Microsoft and Cloud Computing AWS and operation project
IT Programmer,['Recruitment'],Proactive and teamwork skills
IT Supervisor,['Hospitality Hotel'],IT literacy
IT Support Associate EPS,['Travel Tourism Transportation'],Networking basic knowledge
IT Support Engineer,"['IT Telecom', 'IT Telecom', 'IT Telecom']",Able to work under pressure and Good communication skills and Good in IT knowledge
IT Support administrator,['Medical Healthcare'],System Network Administrator
IT Technician,"['IT Telecom', 'IT Telecom']",IT Technicial support and IT Service Management
Import Officer Male Female Post Yangon Pazontaung,['Shipping Logistics'],Jobs relevant to Shipping Line
Import Officer Yangon Male Pazontaung,['Shipping Logistics'],Import Document Management
In Campus English Teacher,['Education Training'],Proactive and teamwork skills
Injection Machine Operator Hlaing Thar Yar,"['Manufacturing Warehousing', 'Manufacturing Warehousing']",Injection Blowing Machine and Plastic Injection Molding
Injection Machine Operator Yangon,"['Manufacturing Warehousing', 'Manufacturing Warehousing', 'Manufacturing Warehousing', 'Manufacturing Warehousing']",Factory Maintenance and Utility and Injection Blowing Machine and Plastic Injection Molding and Teamwork communication skills
Instrumental Music Teacher Urgent,['Education Training'],Singing Playing Music Instrumen
Interior Design Drafter Post,['Construction Engineering'],Design Engineer
Interior Designer,"['Agriculture', 'Construction Engineering', 'Construction Engineering']",Design and Proactive and teamwork skills and Design Engineering
Interior Site Engineer,"['Construction Engineering', 'Construction Engineering', 'Construction Engineering', 'Construction Engineering']",Proactive and teamwork skills and Proficient Problem Solving and Planning communicating monitor and Good at team work
Internal Audit MDY,['Mining Metal Chemicals'],Finance Accounting Field
Internal Auditor,"['Manufacturing Warehousing', 'Manufacturing Warehousing', 'Manufacturing Warehousing', 'Manufacturing Warehousing', 'Manufacturing Warehousing', 'Manufacturing Warehousing', 'Manufacturing Warehousing', 'Manufacturing Warehousing', 'Manufacturing Warehousing']",Financial Analysic Budgeting and Negotiations and Leadership skill and Reporting and analysis and Quality Auditing and Reporting and Financial Analysis and Presentation and Reporting and Coordinate and Communication
International Finance Officer,"['Medical Healthcare', 'Medical Healthcare']",Financial Management and Accounting Financial
Japanese EC Operator,"['IT Telecom', 'IT Telecom', 'IT Telecom', 'IT Telecom', 'IT Telecom', 'IT Telecom', 'IT Telecom']",Sales Marketing and Ecommerce and SEO and Commercial and Market awareness and Ecommerce Sales and Advertising and promotion and Japanese N
Java Programmer,['BPO Business Process Outsourcing'],IT literacy
Java Programmer Japan,['IT Telecom'],Proactive and teamwork skills
Java Web Developer,['Banking Micro finance Insurance'],Web developer HTML CSS
Jr Accountant Accountant WIN MYINT MO INDUSTRIES COMPANY,['Energy Utilities'],Accounting Finance
Jr Admin Executive Male Only,"['Retail Fashion FMCG', 'Retail Fashion FMCG', 'Retail Fashion FMCG', 'Retail Fashion FMCG']",communication interpersonal and Computer Typing English Myanmar and Computer Excel Office word pdf and Administration Data analysis
Junior Account,"['Retail Fashion FMCG', 'Retail Fashion FMCG']",Microsoft Excel and Computerize Skill
Junior Accountant,"['Banking Micro finance Insurance', 'Banking Micro finance Insurance', 'Banking Micro finance Insurance', 'Banking Micro finance Insurance', 'Banking Micro finance Insurance', 'Banking Micro finance Insurance', 'Banking Micro finance Insurance', 'Banking Micro finance Insurance', 'Law Compliance', 'Law Compliance', 'Law Compliance', 'Law Compliance', 'Law Compliance', 'Law Compliance', 'Law Compliance', 'Law Compliance', 'Law Compliance', 'Manufacturing Warehousing', 'Manufacturing Warehousing', 'Manufacturing Warehousing', 'Property Real Estate', 'Manufacturing Warehousing', 'Manufacturing Warehousing', 'Manufacturing Warehousing']",Accounts Payable Receivable and Sale Admin Account Logistic WH and Excel Software and Microsoft s and Accounts Payable Receivable and Sale Admin Account Logistic WH and Excel Software and Microsoft s and Banking and Finance Skill and Microsoft s and Teamwork communication skills and Bookkeeping of accounts and SUPPORT TO AUDIT and PAYROLL PROCESS and  and Email internet and MS Word MS Excel MS PowerPoin and Teamwork communication skills and Admin Data entry and  and Lcci Level Microsoft Ex and Finance Accounting Field and Accounting and LCCI Level I II III
Junior Accountant Accountant,['Construction Engineering'],Banking and Finance Skill
Junior Accountant Female post,"['Banking Micro finance Insurance', 'Banking Micro finance Insurance']", and Computer excel word internet em
Junior Accountant For North Oakala,"['Manufacturing Warehousing', 'Manufacturing Warehousing', 'Manufacturing Warehousing', 'Manufacturing Warehousing', 'Manufacturing Warehousing', 'Manufacturing Warehousing']",Accounting and Accounts Payable Receivable and Accounting Finance and Accounting Software Application and Assistant Account and Jr Accountant
